{
  "detector_id": "cusum",
  "state_schema_version": 1,
  "engine_fingerprint": "cpd-online/0.1.0/linux-x86_64",
  "created_at_ns": 1738886400000000000,
  "payload_codec": "json",
  "payload_crc32": 4122538502,
  "payload": [
    123,
    34,
    116,
    34,
    58,
    51,
    44,
    34,
    119,
    97,
    116,
    101,
    114,
    109,
    97,
    114,
    107,
    95,
    110,
    115,
    34,
    58,
    110,
    117,
    108,
    108,
    44,
    34,
    115,
    99,
    111,
    114,
    101,
    34,
    58,
    48,
    46,
    50,
    44,
    34,
    115,
    116,
    101,
    112,
    115,
    95,
    115,
    105,
    110,
    99,
    101,
    95,
    97,
    108,
    101,
    114,
    116,
    34,
    58,
    51,
    125
  ]
}
